{
  "name": "TestAgent",
  "description": "A test AI agent for integration testing",
  "version": "1.0.0",
  "protocolVersion": "1.0",
  "supportedInterfaces": [
    { "url": "https://example.com/agent", "protocolBinding": "http+json", "protocolVersion": "1.0" }
  ],
  "provider": {
    "organization": "Test Organization",
    "url": "https://example.com"
  },
  "capabilities": {
    "streaming": true,
    "pushNotifications": false
  },
  "skills": [
    {
      "id": "test-skill",
      "name": "Test Skill",
      "description": "A test skill for testing",
      "tags": ["testing"]
    }
  ],
  "defaultInputModes": ["text"],
  "defaultOutputModes": ["text"],
  "securitySchemes": {
    "bearer": { "type": "httpAuth", "scheme": "Bearer" }
  }
}
